{
  "$id": "https://helixprojectai.com/schemas/hgl-hop-decision-1.0.json",
  "$schema": "http://json-schema.org/draft-07/schema#",
  "title": "Helix Glyph Language (HGL) â€” HOP Decision Record v1.0",
  "type": "object",
  "additionalProperties": false,
  "required": [
    "decision_id",
    "inputs",
    "outcome",
    "rationale",
    "confidence",
    "ethics_check"
  ],
  "properties": {
    "spec_version": {
      "type": "string",
      "pattern": "^\\d+\\.\\d+(?:\\.\\d+)?$"
    },
    "decision_id": {
      "type": "string",
      "pattern": "^HGL-HOP-[A-Z0-9_-]+$"
    },
    "inputs": {
      "type": "object",
      "additionalProperties": false,
      "required": [ "glyphs", "evidence" ],
      "properties": {
        "glyphs": {
          "type": "array",
          "items": {
            "type": "string",
            "pattern": "^HGL-(?:CORE|T\\d|XPR)-\\d{3}$"
          },
          "minItems": 1,
          "uniqueItems": true
        },
        "evidence": {
          "type": "array",
          "items": {
            "type": "object",
            "additionalProperties": true
          },
          "minItems": 1
        },
        "rules_applied": {
          "type": "array",
          "items": { "type": "string" },
          "description": "Policy/rule identifiers used in the decision"
        }
      }
    },
    "outcome": {
      "type": "object",
      "additionalProperties": false,
      "required": [ "action" ],
      "properties": {
        "action": {
          "type": "string",
          "enum": [
            "INVESTIGATE",
            "INSIGHT",
            "ITERATE",
            "INTEGRATE",
            "KNOWLEDGE",
            "TARGET",
            "VALIDATE",
            "REJECT",
            "OPTIMIZE",
            "SAFEGUARD",
            "ETHICS",
            "TEMPORAL",
            "ANALYTICS",
            "DIALOGUE",
            "COLLAB"
          ]
        },
        "next_state": { "type": "string" },
        "metadata": { "type": "object" }
      }
    },
    "rationale": { "type": "string", "minLength": 1 },
    "confidence": { "type": "number", "minimum": 0, "maximum": 1 },
    "ethics_check": {
      "type": "object",
      "additionalProperties": false,
      "required": [ "passed" ],
      "properties": {
        "passed": { "type": "boolean" },
        "notes": { "type": "string" }
      }
    },
    "timestamps": {
      "type": "object",
      "additionalProperties": false,
      "properties": {
        "ts": {
          "type": "string",
          "pattern": "^\\d{4}-\\d{2}-\\d{2}T\\d{2}:\\d{2}:\\d{2}Z$"
        }
      }
    },
    "audit": {
      "type": "object",
      "additionalProperties": false,
      "properties": {
        "signer": { "type": "string" },
        "audit_hash": { "type": "string", "pattern": "^[a-f0-9]{64}$" },
        "ledger_seq": { "type": "integer", "minimum": 0 }
      }
    },
    "x_ext": { "type": "object" }
  }
}
